<?xml version="1.0" encoding="ISO-8859-1" standalone="no"?>
<!DOCTYPE compose PUBLIC "http://www.cms.livjm.ac.uk/PUCsec/dtds/compose.dtd" "compose.dtd">
<compose type="standard">

  <sandbox id="s2" config="c3">Binary tree</sandbox>

  <property id="Any">Defined to be any property</property>
  <property id="id1">A particular property</property>

  <configuration id="c3">
    <component id="c4">
      <input format=""/>
      <output format="id1 id1" cycle="disallow"/>
      <component id="c5">
        <input format="id1" cycle="disallow"/>
        <output config="c4" format="id1 id1" cycle="disallow"/>
        <output format=""/>
      </component>
    </component>
  </configuration>


</compose>
