<?xml version="1.0" encoding="ISO-8859-1" standalone="no"?>
<!DOCTYPE compose PUBLIC "http://www.cms.livjm.ac.uk/PUCsec/dtds/compose.dtd" "compose.dtd">
<compose type="extended">

  <sandbox id="s2" config="c1">Write access control check</sandbox>

  <property id="idWrite">Level of access written by component</property>
  <property id="idWAuth">Level of access component is authorised to</property>

  <configuration id="c1" init="1">
    <component id="c2">
      <input format=""/>
      <input id="in1" init="0" format="*"/>
      <process config="check" action="check=@n"/>
      <process id="authority1" init="1" action="@a[@n][0][idWAuth]"/>
      <process cond="result &lt; authority1" action="c1=0"/>

      <output id="out1" init="0" format="*" cond="c1==1"/>
      <component>
        <process config="check" action="check=@n"/>
        <process id="authority2" init="1" action="@a[@n][0][idWAuth]"/>
        <process cond="result &lt; authority2" action="c1=0"/>

        <input id="in2" init="0" format="*"/>
        <output id="out2" init="0" format="*" config="c2" follow="fresh" cond="c1==1"/>
        <output format="" cond="c1==1"/>
      </component>
    </component>
  </configuration>

  <process id="check" init="0">
    <process id="result" init="0" action="@v=(0-1)"/>
    <process id="stack_pos" init="0" action="@v=0"/>
    <process id="node_stack" init="0" action="@v=check"/>
    <process id="link_stack" init="0" action="@v=0"/>
    <process id="node_visited" init="0" action="@v=0"/>
    <process id="recurse">
      <process id="current_node" init="0" action="@v=node_stack[stack_pos]"/>

      <process id="write" init="0" action="@a[current_node][0][idWrite]"/>
      <process cond="(result &lt; 0) || (result &gt; write)" action="result=write"/>

      <process id="current_link" init="0" action="@v=link_stack[stack_pos]"/>
      <process action="node_visited[(current_node + 1)]=1"/>
      <process id="find_link">
        <process id="next_node" init="0" action="@v=@oln[current_node][current_link]" cond="current_link &lt; @olnum[current_node]"/>
        <process config="find_link" cond="(current_link &lt; @olnum[current_node]) &amp;&amp; (node_visited[(next_node + 1)]==1)" action="current_link=(current_link+1)"/>
        <process cond="(current_link &lt; @olnum[current_node]) &amp;&amp; (node_visited[(next_node + 1)]==0)" action="(link_stack[stack_pos]=(current_link+1)) &amp;&amp; (stack_pos=(stack_pos+1)) &amp;&amp; (node_stack[stack_pos]=next_node) &amp;&amp; (link_stack[stack_pos]=0)" config="recurse"/>
        <process cond="(current_link &gt;= @olnum[current_node]) &amp;&amp; (stack_pos &gt;= 0)" action="stack_pos=(stack_pos-1)" config="recurse"/>
      </process>
    </process>
  </process>




</compose>
